<?xml version="1.0" encoding="UTF-8"?>
<TransPool xmlns:xsi="http://www.w3.org/2001/XMLSchema-instance" xsi:noNamespaceSchemaLocation="transpool.xsd">
	<MapDescriptor>
		<MapBoundries length="20" width="20"/>
		<Stops>
			<Stop name="Park Hayarkon" x="2" y="2"/>
			<Stop name="Independance Garden" x="4" y="4"/>
			<Stop name="Square Hamedina" x="9" y="4"/>
			<Stop name="Bursa" x="12" y="3"/>
			<Stop name="Ayallon Mall" x="16" y="1"/>
			<Stop name="Rabin Square" x="8" y="6"/>
			<Stop name="Azriely Mall" x="10" y="8"/>
			<Stop name="Lagardia" x="11" y="10"/>
			<Stop name="MTA" x="6" y="12"/>
			<Stop name="Yaffa Port" x="2" y="11"/>
			<Stop name="Wolfson train" x="5" y="15"/>
			<Stop name="Grouping Exilse" x="10" y="13"/>
			<Stop name="Saffari" x="15" y="14"/>
			<Stop name="Mesubim" x="15" y="15"/>
			<Stop name="Ganot" x="14" y="17"/>
			<Stop name="Mikve Israel" x="9" y="16"/>
			<Stop name="Holon Mall" x="9" y="18"/>
			<Stop name="HIT" x="7" y="18"/>
			<Stop name="Yoseftal" x="5" y="18"/>
		</Stops>
		<Paths>
			<Path from="Mikve Israel" to="Holon Mall">
				<Length>5</Length>
				<FuelConsumption>8</FuelConsumption>
				<SpeedLimit>60</SpeedLimit>
			</Path>																		
			<Path from="HIT" to="Holon Mall" one-way="true">
				<Length>1</Length>
				<FuelConsumption>4</FuelConsumption>
				<SpeedLimit>12</SpeedLimit>
			</Path>																		
			<Path from="Yoseftal" to="HIT">
				<Length>5</Length>
				<FuelConsumption>6</FuelConsumption>
				<SpeedLimit>60</SpeedLimit>
			</Path>																		
			<Path from="Wolfson train" to="Yoseftal">
				<Length>5</Length>
				<FuelConsumption>12</FuelConsumption>
				<SpeedLimit>60</SpeedLimit>
			</Path>																		
			<Path from="Wolfson train" to="Mikve Israel">
				<Length>6</Length>
				<FuelConsumption>8</FuelConsumption>
				<SpeedLimit>24</SpeedLimit>
			</Path>																		
			<Path from="Ganot" to="Mikve Israel">
				<Length>6</Length>
				<FuelConsumption>10</FuelConsumption>
				<SpeedLimit>18</SpeedLimit>
			</Path>																		
			<Path from="Ganot" to="Grouping Exilse">
				<Length>6</Length>
				<FuelConsumption>12</FuelConsumption>
				<SpeedLimit>72</SpeedLimit>
			</Path>																		
			<Path from="Ganot" to="Mesubim">
				<Length>5</Length>
				<FuelConsumption>12</FuelConsumption>
				<SpeedLimit>30</SpeedLimit>
			</Path>																		
			<Path from="Grouping Exilse" to="Mesubim">
				<Length>10</Length>
				<FuelConsumption>8</FuelConsumption>
				<SpeedLimit>60</SpeedLimit>
			</Path>																		
			<Path from="Mesubim" to="Saffari" one-way="true">
				<Length>1</Length>
				<FuelConsumption>6</FuelConsumption>
				<SpeedLimit>12</SpeedLimit>
			</Path>																		
			<Path from="Ayallon Mall" to="Saffari">
				<Length>14</Length>
				<FuelConsumption>10</FuelConsumption>
				<SpeedLimit>28</SpeedLimit>
			</Path>																
			<Path from="Wolfson train" to="Yaffa Port" one-way="true">
				<Length>4</Length>
				<FuelConsumption>8</FuelConsumption>
				<SpeedLimit>16</SpeedLimit>
			</Path>																
			<Path from="MTA" to="Wolfson train">
				<Length>3</Length>
				<FuelConsumption>8</FuelConsumption>
				<SpeedLimit>12</SpeedLimit>
			</Path>														
			<Path from="Mikve Israel" to="Grouping Exilse">
				<Length>3</Length>
				<FuelConsumption>8</FuelConsumption>
				<SpeedLimit>9</SpeedLimit>
			</Path>												
			<Path from="Lagardia" to="Grouping Exilse">
				<Length>2</Length>
				<FuelConsumption>12</FuelConsumption>
				<SpeedLimit>24</SpeedLimit>
			</Path>										
			<Path from="Yaffa Port" to="MTA" one-way="true">
				<Length>6</Length>
				<FuelConsumption>6</FuelConsumption>
				<SpeedLimit>72</SpeedLimit>
			</Path>										
			<Path from="MTA" to="Lagardia">
				<Length>4</Length>
				<FuelConsumption>8</FuelConsumption>
				<SpeedLimit>12</SpeedLimit>
			</Path>										
			<Path from="Azriely Mall" to="Lagardia">
				<Length>4</Length>
				<FuelConsumption>12</FuelConsumption>
				<SpeedLimit>16</SpeedLimit>
			</Path>								
			<Path from="Rabin Square" to="MTA">
				<Length>8</Length>
				<FuelConsumption>8</FuelConsumption>
				<SpeedLimit>32</SpeedLimit>
			</Path>						
			<Path from="Azriely Mall" to="Bursa">
				<Length>10</Length>
				<FuelConsumption>8</FuelConsumption>
				<SpeedLimit>60</SpeedLimit>
			</Path>				
			<Path from="Azriely Mall" to="Rabin Square">
				<Length>5</Length>
				<FuelConsumption>5</FuelConsumption>
				<SpeedLimit>30</SpeedLimit>
			</Path>				
			<Path from="Square Hamedina" to="Rabin Square">
				<Length>5</Length>
				<FuelConsumption>5</FuelConsumption>
				<SpeedLimit>30</SpeedLimit>
			</Path>
			<Path from="Bursa" to="Ayallon Mall">
				<Length>5</Length>
				<FuelConsumption>6</FuelConsumption>
				<SpeedLimit>60</SpeedLimit>
			</Path>		
			<Path from="Bursa" to="Square Hamedina">
				<Length>8</Length>
				<FuelConsumption>6</FuelConsumption>
				<SpeedLimit>24</SpeedLimit>
			</Path>					
			<Path from="Park Hayarkon" to="Square Hamedina">
				<Length>16</Length>
				<FuelConsumption>10</FuelConsumption>
				<SpeedLimit>64</SpeedLimit>
			</Path>
			<Path from="Square Hamedina" to="Independance Garden">
				<Length>14</Length>
				<FuelConsumption>10</FuelConsumption>
				<SpeedLimit>84</SpeedLimit>
			</Path>
		</Paths>
	</MapDescriptor>
	<PlannedTrips>	
		<TransPoolTrip>
			<Owner>Purpule</Owner>
			<Capacity>4</Capacity>
			<PPK>20</PPK>
			<Route path="Rabin Square,Azriely Mall,Lagardia,Grouping Exilse,Mikve Israel,Ganot,Mesubim,Saffari"/>
			<Scheduling hour-start="10"/>
		</TransPoolTrip>		
		<TransPoolTrip>
			<Owner>Blue</Owner>
			<Capacity>4</Capacity>
			<PPK>50</PPK>
				<Route path="HIT,Holon Mall,Mikve Israel,Grouping Exilse,Mesubim,Saffari,Ayallon Mall,Bursa,Square Hamedina,Independance Garden"/>
			<Scheduling hour-start="14"/>
		</TransPoolTrip>	
		<TransPoolTrip>
			<Owner>Green</Owner>
			<Capacity>3</Capacity>
			<PPK>10</PPK>
			<Route path="Yoseftal,Wolfson train,MTA,Rabin Square"/>
			<Scheduling hour-start="13"/>
		</TransPoolTrip>	
		<TransPoolTrip>
			<Owner>Orange</Owner>
			<Capacity>4</Capacity>
			<PPK>20</PPK>
			<Route path="HIT,Yoseftal,Wolfson train,MTA,Lagardia,Azriely Mall, Rabin Square,Square Hamedina,Park Hayarkon"/>
			<Scheduling hour-start="7"/>
		</TransPoolTrip>
		<TransPoolTrip>
			<Owner>Red</Owner>
			<Capacity>3</Capacity>
			<PPK>25</PPK>
			<Route path="Wolfson train,Yaffa Port,MTA,Lagardia,Azriely Mall,Bursa,Square Hamedina,Park Hayarkon"/>
			<Scheduling hour-start="8"/>
		</TransPoolTrip>
	</PlannedTrips>
</TransPool>
